<?xml version="1.0" encoding="UTF-8" ?>

<!ELEMENT map (action*,other-actions?)>

<!ELEMENT action (role*)>
<!ATTLIST action path CDATA #REQUIRED>

<!ELEMENT other-actions (role*)>

<!ELEMENT role EMPTY>
<!ATTLIST role name (guest|damned|user|admin) #REQUIRED>


